{
  "$schema": "http://json-schema.org/draft-07/schema#",
  "$id": "jankurai-audit-state/1",
  "title": "SmartScanState",
  "description": "Persisted result of the most recent successful full-scope jankurai audit, used by smart scan to decide whether a fast scan suffices.",
  "type": "object",
  "required": [
    "schema_version",
    "last_full_scan_at",
    "last_full_scan_commit",
    "last_full_hard_findings",
    "last_full_caps",
    "last_full_auditor_version"
  ],
  "additionalProperties": false,
  "properties": {
    "schema_version": {
      "type": "string",
      "description": "Schema version for this document (semver).",
      "pattern": "^\\d+\\.\\d+\\.\\d+$"
    },
    "last_full_scan_at": {
      "type": "integer",
      "description": "Unix seconds when the full scan completed."
    },
    "last_full_scan_commit": {
      "type": "string",
      "description": "Short git commit SHA at the time of the full scan."
    },
    "last_full_hard_findings": {
      "type": "integer",
      "minimum": 0,
      "description": "Hard-finding count from the full scan (0 = clean)."
    },
    "last_full_caps": {
      "type": "array",
      "items": { "type": "string" },
      "description": "Score caps applied during the full scan (empty = clean)."
    },
    "last_full_auditor_version": {
      "type": "string",
      "description": "Auditor version that produced the state (semver).",
      "pattern": "^\\d+\\.\\d+\\.\\d+$"
    }
  }
}
