{
  "schema_version": "1.0.0",
  "last_full_scan_at": 1788954106,
  "last_full_scan_commit": "",
  "last_full_hard_findings": 8,
  "last_full_caps": [
    "no-root-agent-instructions",
    "no-one-command-setup-or-validation",
    "no-deterministic-fast-lane",
    "no-security-lane-on-high-risk-repo",
    "no-secret-or-dependency-scanning-in-ci",
    "no-jankurai-audit-lane-in-ci",
    "release-readiness-gap",
    "missing-rust-property-or-integration-tests",
    "no-agent-friendly-exception-pattern",
    "missing-agent-readable-docs"
  ],
  "last_full_auditor_version": "1.7.0"
}